[
  {
    "conf": 1,
    "h": 0.045,
    "text": "649221",
    "w": 0.133,
    "x": 0.197,
    "yTop": 0.283
  },
  {
    "conf": 1,
    "h": 0.035,
    "text": "NIKE",
    "w": 0.058,
    "x": 0.195,
    "yTop": 0.337
  },
  {
    "conf": 0.5,
    "h": 0.047,
    "text": "듀라필10 골프장갑",
    "w": 0.212,
    "x": 0.196,
    "yTop": 0.376
  },
  {
    "conf": 1,
    "h": 0.043,
    "text": "2개입",
    "w": 0.067,
    "x": 0.196,
    "yTop": 0.413
  },
  {
    "conf": 1,
    "h": 0.028,
    "text": "NIKE SYNTHETIC GLOVES 2PK",
    "w": 0.179,
    "x": 0.197,
    "yTop": 0.448
  },
  {
    "conf": 0.5,
    "h": 0.021,
    "text": "• 제품특징",
    "w": 0.051,
    "x": 0.198,
    "yTop": 0.473
  },
  {
    "conf": 0.5,
    "h": 0.02,
    "text": "- 왼손용 2 개",
    "w": 0.067,
    "x": 0.198,
    "yTop": 0.494
  },
  {
    "conf": 0.5,
    "h": 0.022,
    "text": "• 제품 사이즈",
    "w": 0.063,
    "x": 0.44,
    "yTop": 0.482
  },
  {
    "conf": 1,
    "h": 0.021,
    "text": "• 원산지 : 인도네시아",
    "w": 0.106,
    "x": 0.198,
    "yTop": 0.514
  },
  {
    "conf": 1,
    "h": 0.026,
    "text": "-남성 : 21.5(S) ,22(M) , 22.5(ML)",
    "w": 0.14,
    "x": 0.44,
    "yTop": 0.5
  },
  {
    "conf": 0.5,
    "h": 0.021,
    "text": "• 소재: 양피, 합성피혁",
    "w": 0.106,
    "x": 0.199,
    "yTop": 0.533
  },
  {
    "conf": 1,
    "h": 0.02,
    "text": "-여성 : 19.5(S)",
    "w": 0.067,
    "x": 0.439,
    "yTop": 0.521
  },
  {
    "conf": 0.5,
    "h": 0.02,
    "text": ",20(M)",
    "w": 0.031,
    "x": 0.506,
    "yTop": 0.523
  },
  {
    "conf": 0.5,
    "h": 0.026,
    "text": "단가 / 개",
    "w": 0.062,
    "x": 0.2,
    "yTop": 0.569
  },
  {
    "conf": 1,
    "h": 0.136,
    "text": "23,890원",
    "w": 0.245,
    "x": 0.399,
    "yTop": 0.559
  },
  {
    "conf": 1,
    "h": 0.044,
    "text": "11,945원",
    "w": 0.088,
    "x": 0.199,
    "yTop": 0.59
  },
  {
    "conf": 1,
    "h": 0.01,
    "text": "26A0I",
    "w": 0.026,
    "x": 0.202,
    "yTop": 0.645
  }
]